{"schema_version":"pysolate.workspace-diff.v1","source_sha256":"sha256:3988ea147d1730987668f1df3567fd9ca4dfe657f591e3644077bb4745755069","generated_at_policy":"omitted","run_id":"run-empty","base_run_id":"run-empty-parent","changes":[],"page":{"cursor":"","next_cursor":"","returned":0,"total":0,"truncated":false}}